Key,Concept
profitability analysis,measure the ability of the firm to generate earnings
relationship between profitability and liquidity , high level of profitability doesn't indicate there is no issue in liquidity as the accrual basis is applied by the accountant
Net profit margin or rate of return on sales, = net income / net sales
 , this ratio compute the net profit achieved by each pound of net sales 
Total asset trurnover, measures the ability of the firm to generate net sales through the active use of assests in different operations of the firm
rate of return on assets, measures the net profit achieved by each pound of Total assets
  , this ratio is also called return on investment (ROI)
rate of return on total equity, measure the ability of owner's equity to generate net profit
Rate of return on total equity , measures the ability of owner's equity to generate net profit